{
  "acp": "1.2",
  "message_id": "0193f8d8-4c4e-7d8b-a2ab-000000000131",
  "type": "asset.sync",
  "source": {
    "node_id": "0193f8d8-4c4e-7d8b-a2ab-000000000001"
  },
  "timestamp_utc": "2026-08-17T16:42:15.231Z",
  "qos": "reliable",
  "flags": [],
  "payload": {
    "asset": {
      "asset_id": "0193f8d8-4c4e-7d8b-a2ab-000000000071",
      "asset_type": "lyric.chart",
      "revision": 1,
      "sha256": "aaaaaaaaaaaaaaaaaaaaaaaaaaaaaaaaaaaaaaaaaaaaaaaaaaaaaaaaaaaaaaaa",
      "size_bytes": 4
    }
  },
  "destination": {
    "node_id": "0193f8d8-4c4e-7d8b-a2ab-000000000002"
  },
  "session_id": "0193f8d8-4c4e-7d8b-a2ab-000000000013",
  "sequence": 1
}
