{
  "acp": "1.2",
  "message_id": "0193f8d8-4c4e-7d8b-a2ab-000000000041",
  "type": "remote.hello_ack",
  "source": {
    "node_id": "0193f8d8-4c4e-7d8b-a2ab-000000000001"
  },
  "timestamp_utc": "2026-08-17T16:42:15.231Z",
  "qos": "reliable",
  "flags": [],
  "payload": {
    "accepted": true,
    "permissions": {
      "roles": [
        "remote.operator",
        "remote.busker"
      ],
      "revision": 1
    },
    "show_id": "0193f8d8-4c4e-7d8b-a2ab-000000000050",
    "show_revision": 1,
    "layout_id": "0193f8d8-4c4e-7d8b-a2ab-0000000000a0",
    "layout_revision": 8
  },
  "session_id": "0193f8d8-4c4e-7d8b-a2ab-0000000000c0",
  "sequence": 1,
  "destination": {
    "node_id": "0193f8d8-4c4e-7d8b-a2ab-0000000000b0"
  }
}
