{
  "acp": "1.2",
  "message_id": "0193f8d8-4c4e-7d8b-a2ab-000000000114",
  "type": "security.state",
  "source": {
    "node_id": "0193f8d8-4c4e-7d8b-a2ab-000000000001"
  },
  "timestamp_utc": "2026-08-17T16:42:15.231Z",
  "qos": "latest",
  "flags": [],
  "payload": {
    "principal_state": "authenticated",
    "auth_mode": "aurora_trust",
    "profile": "full",
    "trust_domain_id": "0193f8d8-4c4e-7d8b-a2ab-000000000090",
    "credential_id": "sha256:aaaaaaaaaaaaaaaaaaaaaaaaaaaaaaaaaaaaaaaaaaaaaaaaaaaaaaaaaaaaaaaa",
    "revocation_epoch": 7,
    "downgrade_allowed": false
  },
  "destination": {
    "node_id": "0193f8d8-4c4e-7d8b-a2ab-000000000002"
  },
  "session_id": "0193f8d8-4c4e-7d8b-a2ab-000000000013",
  "sequence": 1
}
