{
  "acp": "1.2",
  "message_id": "0193f8d8-4c4e-7d8b-a2ab-000000000033",
  "type": "participant.identity",
  "source": {
    "node_id": "0193f8d8-4c4e-7d8b-a2ab-000000000001"
  },
  "timestamp_utc": "2026-08-17T16:42:15.231Z",
  "qos": "reliable",
  "flags": [],
  "payload": {
    "participant_id": "0193f8d8-4c4e-7d8b-a2ab-000000000080",
    "name": "Dakota"
  },
  "destination": {
    "node_id": "0193f8d8-4c4e-7d8b-a2ab-000000000002"
  },
  "session_id": "0193f8d8-4c4e-7d8b-a2ab-000000000013",
  "sequence": 1
}
