{
  "acp": "1.2",
  "message_id": "0193f8d8-4c4e-7d8b-a2ab-000000000044",
  "type": "remote.permissions",
  "source": {
    "node_id": "0193f8d8-4c4e-7d8b-a2ab-000000000001"
  },
  "timestamp_utc": "2026-08-17T16:42:15.231Z",
  "qos": "reliable",
  "flags": [],
  "payload": {
    "roles": [
      "remote.operator",
      "remote.busker"
    ],
    "capabilities": [
      "remote.control.invoke"
    ],
    "revision": 1
  },
  "session_id": "0193f8d8-4c4e-7d8b-a2ab-0000000000c0",
  "sequence": 1,
  "destination": {
    "node_id": "0193f8d8-4c4e-7d8b-a2ab-0000000000b0"
  }
}
