{
  "acp": "1.2",
  "message_id": "0193f8d8-4c4e-7d8b-a2ab-000000000144",
  "type": "chart.assignment",
  "source": {
    "node_id": "0193f8d8-4c4e-7d8b-a2ab-000000000001"
  },
  "timestamp_utc": "2026-08-17T16:42:15.231Z",
  "qos": "reliable",
  "flags": [],
  "payload": {
    "show_id": "0193f8d8-4c4e-7d8b-a2ab-000000000050",
    "song_id": "haywire",
    "participant_id": "0193f8d8-4c4e-7d8b-a2ab-000000000080",
    "device_id": "0193f8d8-4c4e-7d8b-a2ab-000000000002",
    "chart": {
      "asset_id": "0193f8d8-4c4e-7d8b-a2ab-000000000071",
      "revision": 1,
      "sha256": "aaaaaaaaaaaaaaaaaaaaaaaaaaaaaaaaaaaaaaaaaaaaaaaaaaaaaaaaaaaaaaaa"
    },
    "reason": "explicit_assignment"
  },
  "destination": {
    "node_id": "0193f8d8-4c4e-7d8b-a2ab-000000000002"
  },
  "session_id": "0193f8d8-4c4e-7d8b-a2ab-000000000013",
  "sequence": 1
}
