{
  "acp": "1.2",
  "message_id": "0193f8d8-4c4e-7d8b-a2ab-000000000040",
  "type": "remote.hello",
  "source": {
    "node_id": "0193f8d8-4c4e-7d8b-a2ab-0000000000b0"
  },
  "timestamp_utc": "2026-08-17T16:42:15.231Z",
  "qos": "reliable",
  "flags": [],
  "payload": {
    "remote": {
      "node_id": "0193f8d8-4c4e-7d8b-a2ab-0000000000b0",
      "instance_id": "0193f8d8-4c4e-7d8b-a2ab-0000000000b1",
      "device_id": "0193f8d8-4c4e-7d8b-a2ab-0000000000b2",
      "remote_id": "0193f8d8-4c4e-7d8b-a2ab-0000000000b3",
      "device_name": "FOH iPad",
      "platform": "ipados",
      "app_version": "1.0.0"
    },
    "roles": [
      "remote.operator",
      "remote.busker"
    ],
    "capabilities": [
      {
        "id": "remote.profile",
        "version": "1.0"
      }
    ]
  },
  "session_id": "0193f8d8-4c4e-7d8b-a2ab-0000000000c0",
  "sequence": 1,
  "destination": {
    "node_id": "0193f8d8-4c4e-7d8b-a2ab-000000000001"
  }
}
