{
  "acp": "1.2",
  "message_id": "0193f8d8-4c4e-7d8b-a2ab-000000000100",
  "type": "security.enrollment.status",
  "source": {
    "node_id": "0193f8d8-4c4e-7d8b-a2ab-000000000001"
  },
  "timestamp_utc": "2026-08-17T16:42:15.231Z",
  "qos": "latest",
  "flags": [],
  "payload": {
    "enrollment_id": "0193f8d8-4c4e-7d8b-a2ab-000000000091",
    "state": "open",
    "expires_at": "2026-08-17T16:42:15.231Z",
    "supported_suites": [
      "ACP-SPAKE2PLUS-P256-SHA256-HKDFSHA256-RAW128-v1"
    ],
    "methods": [
      "manual_code"
    ],
    "attempts_remaining": 5
  },
  "destination": {
    "node_id": "0193f8d8-4c4e-7d8b-a2ab-000000000002"
  },
  "session_id": "0193f8d8-4c4e-7d8b-a2ab-000000000013",
  "sequence": 1
}
