{
  "acp": "1.2",
  "message_id": "0193f8d8-4c4e-7d8b-a2ab-000000000112",
  "type": "security.revocation.update",
  "source": {
    "node_id": "0193f8d8-4c4e-7d8b-a2ab-000000000001"
  },
  "timestamp_utc": "2026-08-17T16:42:15.231Z",
  "qos": "reliable",
  "flags": [],
  "payload": {
    "body": {
      "format": "acp-revocation-snapshot-v1",
      "trust_domain_id": "0193f8d8-4c4e-7d8b-a2ab-000000000090",
      "epoch": 7,
      "issued_at": "2026-08-17T16:42:15.231Z",
      "next_update": "2026-08-17T16:42:15.231Z",
      "entries": [
        {
          "credential_id": "sha256:aaaaaaaaaaaaaaaaaaaaaaaaaaaaaaaaaaaaaaaaaaaaaaaaaaaaaaaaaaaaaaaa",
          "node_id": "0193f8d8-4c4e-7d8b-a2ab-000000000002",
          "revoked_at": "2026-08-17T16:42:15.231Z",
          "reason": "key_compromise"
        }
      ],
      "issuer_key_id": "sha256:aaaaaaaaaaaaaaaaaaaaaaaaaaaaaaaaaaaaaaaaaaaaaaaaaaaaaaaaaaaaaaaa"
    },
    "algorithm": "ecdsa_p256_sha256",
    "signature": "AQIDBA"
  },
  "destination": {
    "node_id": "0193f8d8-4c4e-7d8b-a2ab-000000000002"
  },
  "session_id": "0193f8d8-4c4e-7d8b-a2ab-000000000013",
  "sequence": 1
}
