{
  "acp": "1.2",
  "message_id": "0193f8d8-4c4e-7d8b-a2ab-000000000051",
  "type": "remote.readiness.changed",
  "source": {
    "node_id": "0193f8d8-4c4e-7d8b-a2ab-000000000001"
  },
  "timestamp_utc": "2026-08-17T16:42:15.231Z",
  "qos": "reliable",
  "flags": [],
  "payload": {
    "state": "syncing_state",
    "session_id": "0193f8d8-4c4e-7d8b-a2ab-0000000000c0",
    "layout_revision": 8,
    "permissions_revision": 1
  },
  "session_id": "0193f8d8-4c4e-7d8b-a2ab-0000000000c0",
  "sequence": 1,
  "destination": {
    "node_id": "0193f8d8-4c4e-7d8b-a2ab-0000000000b0"
  }
}
