{
  "acp": "1.2",
  "message_id": "0193f8d8-4c4e-7d8b-a2ab-000000000101",
  "type": "discovery.query",
  "source": {
    "node_id": "0193f8d8-4c4e-7d8b-a2ab-000000000001"
  },
  "timestamp_utc": "2026-08-17T16:42:15.231Z",
  "qos": "best_effort",
  "flags": [],
  "payload": {
    "role_filter": [
      "bridge"
    ]
  }
}
